{"after_verification_sha256":"cc4927ae00521855b492b5870ce59cd9b87e1d7b4f937b3fe9e61559772f285c","artifact":"change-result","before_verification_sha256":"cc4927ae00521855b492b5870ce59cd9b87e1d7b4f937b3fe9e61559772f285c","contract_sha256":"ef243beb8602425f8db91aae2847a8b8543c59f5b1b65a17f1e5abcdbc575b78","diagnostics":[],"freshness":"current","outcomes":[{"evidence":[{"detail":"extractor actual","line":0,"path":"fuzz.verify.json","project":"","provenance":"asserted","sha256":"f105cfcfd3e65e61693a3c72103abeed2568a93308f05875549f3f66a8c4165a"}],"id":"origin:750bd5e370d3b7834e0b0ecd7977039d8e37199710193385ff9dec1c4958b1b6","kind":"origin","message":"origin finding remains open in the after-state","status":"missing"},{"evidence":[{"detail":"extractor actual","line":0,"path":"fuzz.verify.json","project":"","provenance":"asserted","sha256":"f105cfcfd3e65e61693a3c72103abeed2568a93308f05875549f3f66a8c4165a"}],"id":"postcondition:origin-fact-transition","kind":"postcondition","message":"required fact transition is incomplete","status":"missing"}],"proposal_sha256":"1e6afbd63f8d357717e386a8681ac473c06f780c5f1bd5f123d329c9ab261dcf","provenance":"derived","schema_version":1,"sha256":"1f93e536f8946cd4f6943f62f5f152f9948b72c5025299300240bc4aec63e9a6","status":"missing","tool":{"implementation_sha256":"f4c845f6650ab7bc547fde8c68e6ba3f32308bf796efaec794ab1b935ee6a750","name":"archbird","version":"0.0.1"}}
